I see the master of my boat.,Ñurho lōgro āeksio urnen.
I see my enchantment's master.,Ñurho sētero āeksio urnen.
The ocean's spell guides my friend's boat.,Embro sēter ñuho raqiro lōgor jemas.
The gods of the oceans are dragons.,Embroti jaehossa zaldrīzesse issi.
A girl is praising the dragons' power.,Riña zaldrīzoti kostion rijas.
Forward!,Naejot!
A woman is admiring the mountain's might.,Ābra blēno kostion majaqsa.
This is my power.,Kesy ñuhon kostion issa.
Is this the front side of the mountain?,Kesy blēno naejon issa?
The man fears the dragon's power.,Vala zaldrīzo kostion izūgas.
"Yes, these are the mountains.","Issa, kesi blēna issi."
The might of the mountains intimidates the boy.,Blēnoti kostion taobe ossȳngas.
They see the front sides of the mountains.,Blēnoti naeja urnesi.
The power of the magic spells intimidates the man.,Sēteroti kostion vale ossȳngas.
Do the men see the front of the mountain?,Vali blēno naejon urnesi?
I see the front of the ship.,Lōgro naejon urnen.
The strong man is sweating.,Kostōba vala nages.
A girl finds the Unsullied's mother.,Riña Dovaogēdo muñe rhaenas.
An Unsullied finds the good man's horse.,Dovaogēdy sȳro valo annī rhaenas.
The knights are finding the men's horses.,Azantyssy valoti annī rhaenis.
My friend's horse is beautiful.,Ñuho raqiro anne gevie issa.
The knight's friend is happy.,Azanto raqiros kirine issa.
This is my friend's long sword.,Kesy ñuho raqiro korze issa.
A girl is admiring the dragon's beauty.,Riña zaldrīzo gevivī majaqsa.
I see the ocean's girl.,Embro riñe urnen.
A woman is praising my spell's beauty.,Ābra ñurho sētero gevivī rijas.
The mountain's front side is big.,Blēno naejon rōvon issa.
The man's wolves find fruit.,Valo zokli gerpī rhaenis.
The good horse's master is glad.,Sȳro anno āeksio kirine issa.
Are the knight's friends sleeping?,Azanto raqirossa ēdrusi?
My god's knight is good.,Ñuho jaeho azantys sȳz issa.
This is the front side of the ship.,Kesy lōgro naejon issa.
A girl is admiring the horses' beauty.,Riña annoti gevivī majaqsa.
The master of the ship is afraid of the spell.,Lōgro āeksio sēter izūgas.
The Unsullied's long sword is good.,Dovaogēdo korze sȳz issa.
My house is large.,Ñuhon lenton rōvon issa.
The helmet is big.,Gelte rōva issa.
The kings have my house.,Dāryssy ñuhon lenton ēzi.
Do they see my blood?,Ñuhor ānogri urnesi?
I have royal blood.,Dārōñor ānogri eman.
I have large houses.,Rōva lenta eman.
My helmets are strong.,Ñuhi gelti kostōbi issi.
My blood is lucky.,Ñuhor ānogar biarior issa.
I have my helmets.,Ñuhī geltī eman.
I have my helmet.,Ñuhe geltī eman.
My king's blood is royal.,Ñuho dāro ānogar dārōñor issa.
My blood is royal.,Ñuhor ānogar dārōñor issa.
I have her horse.,Zȳhe annī eman.
Do you have dragons?,Zaldrīzī emā?
Do you have your helmet?,Aōhe geltī emā?
The Targaryen has her throne.,Targārien jāhon dēmalion ēza.
This knight is my friend.,Bisys azantys ñuhys raqiros issa.
Is your name Daenerys?,Aōha brōzi Daenerys issa?
I see this blood.,Kesor ānogri urnen.
I see her house!,Zȳhon lenton urnen!
A boy is admiring this man.,Taoba bise vale majaqsa.
I hear his spells.,Zȳrha sētera rȳban.
"You have your king, and I have my king.","Aōhi dāri emā, se ñuhi dāri eman."
This one is her father.,Bisy zȳha kepa issa.
The turtle loves his mother.,Qintir jāhe muñe jorrāelza.
This helmet is good.,Kesa gelte sȳz issa.
This mountain is big.,Keson blēnon rōvon issa.
The Targaryen loves his dragons.,Targārien jāhī zaldrīzī jorrāelza.
Are these guests your friends?,Bisyz zentyssy aōhyz raqirossa issi?
We have your king.,Aōhi dāri emi.
Your boys are eating my fruit!,Jevi taobi ñuhī gerpī ipradis!
That house is large.,Konon lenton rōvon issa.
Their horses are asleep.,Pōji anni ēdrusi.
Your mother is a good woman.,Jeva muña sȳz ābra issa.
That knight is good.,Bonys azantys sȳz issa.
I see that horse.,Bone annī urnen.
I see our boy!,Īlve taobe urnen!
We have our enchantments.,Īlvra sētera emi.
We have their homes.,Pōja lenta emi.
Their men have my father!,Pōji vali ñuhe kepe ēzi!
My dragons are eating your masters.,Ñuhyz zaldrīzesse jevī āeksia ipradis.
That mountain scares those boys.,Konon blēnon bonī taobī ossȳngas.
Those are our helmets.,Koni gelti īlvi issi.
We have green turtles.,Kastra qintra emi.
My blood is blue.,Ñuhor ānogar kastor issa.
That is my king.,Bony ñuhys dārys issa.
These knights are sweating.,Bisyz azantyssy nagesi.
"Truly, you have these helmets.","Drējī, kesī geltī emā."
This man is good.,Bisa vala sȳz issa.
My turtle is eating his piece of fruit.,Ñuhor qintir jāhe gerpe ipradas.
Do you have blue blood?,Kastor ānogri emā?
We have your turtle!,Aōhor qintir emi!
Their turtle is good.,Pōjor qintir sȳrior issa.
Your house is big.,Jevon lenton rōvon issa.
Do you have that helmet?,Kone geltī emā?
My helmet is strong.,Ñuha gelte kostōba issa.
I have a big house.,Rōvon lenton eman.
"Yes, I have a house.","Issa, lenton eman."
You have his helmets.,Zȳhī geltī emā.
This mountain is my home.,Keson blēnon ñuhon lenton issa.
This knight is asleep.,Bisys azantys ēdrus.
Do you have a friend?,Raqiros emā?
His name is Jon.,Zȳha brōzi Iōnos issa.
The turtle loves her home.,Qintir jāhon lenton jorrāelza.
Does the king respect these turtles?,Dārys keja qintra iotāptes?
That man is my father.,Bona vala ñuha kepa issa.
That is our girl!,Bony īlva riña issa!
Their knights are sweating.,Pōjyz azantyssy nagesi.
We have their blood.,Pōja ānogrī emi.
The king has my home.,Dārys ñuhon lenton ēza.
I have dragons.,Zaldrīzī eman.
This woman is my knight.,Bisa ābra ñuhys azantys issa.
The Targaryen is admiring his iron throne.,Targārien jāhon āegenkon dēmalion majaqsa.
This turtle is sleeping.,Kesor qintir ēdrus.
Those birds see the wolves.,Bonyz hontesse zoklī urnesi.
